{
    "v": 1,
    "chapter": -1,
    "level": 3,
    "title": "Speed Build",
    "description": "Build a perovskite structure in 60 seconds. Time is everything.",
    "domain": "crystal",
    "construction_mode": "wyckoff_fill",
    "space_group_symbol": "Pm-3m",
    "space_group_number": 221,
    "lattice_parameters": {
        "x": 3.91,
        "y": 3.91,
        "z": 3.91
    },
    "lattice_angles": {
        "x": 90.0,
        "y": 90.0,
        "z": 90.0
    },
    "elements": [
        {
            "symbol": "Ca",
            "position": { "x": 0.0, "y": 0.0, "z": 0.0 },
            "wyckoff_label": "a",
            "wyckoff_multiplicity": 1
        },
        {
            "symbol": "Ti",
            "position": { "x": 0.5, "y": 0.5, "z": 0.5 },
            "wyckoff_label": "b",
            "wyckoff_multiplicity": 1
        },
        {
            "symbol": "O",
            "position": { "x": 0.5, "y": 0.5, "z": 0.0 },
            "wyckoff_label": "c",
            "wyckoff_multiplicity": 3
        }
    ],
    "goals": [
        {
            "type": "wyckoff_fill",
            "description": "Place Ca at 1a site (A-site)",
            "element": "Ca",
            "wyckoff": "a",
            "required_count": 1
        },
        {
            "type": "wyckoff_fill",
            "description": "Place Ti at 1b site (B-site)",
            "element": "Ti",
            "wyckoff": "b",
            "required_count": 1
        },
        {
            "type": "wyckoff_fill",
            "description": "Place O at 3c site",
            "element": "O",
            "wyckoff": "c",
            "required_count": 3
        },
        {
            "type": "conservation_check",
            "description": "Perovskite conservation matrix healthy",
            "max_deviation": 0.1
        },
        {
            "type": "verification",
            "description": "Complete speed build verification",
            "required_layer": 0
        }
    ],
    "fog_zones": [],
    "hint": "ABO3 perovskite: A at corner, B at body center, O at face centers. Fill fast, no hesitation.",
    "journal_entry": "Speed builder: 60 seconds. No time for doubt. Muscle memory meets crystal structure.",
    "scale_label": "Å",
    "scale_range": { "x": 0.5, "y": 10.0 },
    "scene_config": {
        "perovskite_type": "ABO3",
        "a_site": "Ca",
        "b_site": "Ti"
    },
    "constraints": {
        "time_limit_seconds": 60
    },
    "reward_cores": 8,
    "available_tools": ["element_block", "wyckoff_snap"]
}
